{
  "schema_version": "1",
  "scenario_id": "minimal",
  "label": "Wedge jaffle fixture",
  "artifacts": {
    "graph": {
      "path": "graph.json",
      "kind": "catalog-artifact",
      "lane": "admin"
    },
    "catalog": {
      "path": "catalog.json",
      "kind": "catalog-artifact",
      "lane": "admin"
    },
    "impacts": {
      "orders_base.amount_upstream": {
        "path": "impacts/orders_base.amount_upstream.json",
        "selection": "orders_base.amount",
        "direction": "upstream"
      }
    }
  },
  "defaults": {
    "impact_key": "orders_base.amount_upstream"
  }
}
